{
  "schema_version": 1,
  "job_id": "boss:SYN0001aaaa",
  "bundle_id": "__BUNDLE_ID__",
  "extra_evidence_ids": [],
  "profile_revision": "example-minimal-v1",
  "idempotency_key": "syn-rpt-both-empty-1",
  "authentic": {
    "facts": [{"evidence_id": "__DETAIL_EVIDENCE_ID__", "claim": "详情页 JD 可读"}],
    "supporting": [],
    "opposing": [],
    "unknowns": ["详情页与公司页均未取得可核验的支持或反对线索"],
    "conclusion": "证据不足",
    "conclusion_label": "推断"
  },
  "jd_translation": {"sentences": [
    {"original": "熟悉 Agent 工作流", "explanation": "需要理解工具之间的任务衔接",
     "evidence_id": "__DETAIL_EVIDENCE_ID__"}
  ]},
  "mismatches": [
    {"requirement": "岗位具体经验门槛", "profile": "画像只提供 QC 流程经历", "severity": "unknown",
     "assumption": "尚未取得可确认经验门槛的 JD 原句"}
  ],
  "resume_advice": {
    "proven": ["按画像自述说明需求拆解与验收职责"],
    "to_reach": ["补充可演示的 AI 工具项目并记录验证过程（尚未具备）"]
  },
  "report_md": "## 招聘信号判断\n事实：详情页 JD 可读。\n支持：未取得。\n反对：未取得。\n未知：支持与反对线索均未取得。\n定性倾向（推断）：证据不足。\n\n## JD 翻译\n熟悉 Agent 工作流：需要理解工具间任务衔接。\n\n## 不匹配点\n经验门槛未知；不推断画像已满足。\n\n## 简历建议\n已证实经历如何表达：说明需求拆解与验收职责。\n要达标还需补的行动：做可演示项目并记录验证过程，不写成已有经历。\n"
}
